<hivemq-snowflake-extension xmlns:xsi="http://www.w3.org/2001/XMLSchema-instance"
                            xsi:noNamespaceSchemaLocation="config.xsd">
    <snowflakes>
        <snowflake>
            <id>my-snowflake-id</id>
            <account-url>https://my-account-id.snowflakecomputing.com</account-url>
            <user>my-user</user>
            <role>my-role</role>
            <private-key>rsa_key.p8</private-key>
            <private-key-passphrase>my-passphrase</private-key-passphrase>
        </snowflake>
    </snowflakes>

    <mqtt-to-snowflake-routes>
        <mqtt-to-snowflake-route>
            <id>my-snowflake-route</id>
            <snowflake-id>my-snowflake-id</snowflake-id>
            <enabled>true</enabled>
            <mqtt-topic-filters>
                <mqtt-topic-filter>#</mqtt-topic-filter>
            </mqtt-topic-filters>
            <processor>
                <snowpipe-streaming>
                    <database>my_database</database>
                    <schema>my_schema</schema>
                    <table>my_table</table>
                    <columns>
                        <column>
                            <name>topic</name>
                            <value>mqtt-topic</value>
                        </column>
                        <column>
                            <name>payload</name>
                            <value>mqtt-payload-utf8</value>
                        </column>
                    </columns>
                </snowpipe-streaming>
            </processor>
        </mqtt-to-snowflake-route>
    </mqtt-to-snowflake-routes>
</hivemq-snowflake-extension>
